{
  "$schema": "https://json-schema.org/draft/2020-12/schema",
  "$id": "urn:sspos:web-portal-api:v1:SaleVat",
  "title": "SaleVat",
  "description": "Payload of a SaleVat row.",
  "type": "object",
  "properties": {
    "saleId": {
      "type": "string"
    },
    "vatRateId": {
      "type": "string"
    },
    "percentage": {
      "type": [
        "string",
        "number"
      ],
      "pattern": "^-?(?:0|[1-9]\\d*)(?:\\.\\d\u002B)?$"
    },
    "code": {
      "type": "string"
    },
    "net": {
      "type": [
        "string",
        "number"
      ],
      "pattern": "^-?(?:0|[1-9]\\d*)(?:\\.\\d\u002B)?$"
    },
    "vat": {
      "type": [
        "string",
        "number"
      ],
      "pattern": "^-?(?:0|[1-9]\\d*)(?:\\.\\d\u002B)?$"
    },
    "gross": {
      "type": [
        "string",
        "number"
      ],
      "pattern": "^-?(?:0|[1-9]\\d*)(?:\\.\\d\u002B)?$"
    },
    "id": {
      "type": "string"
    },
    "companyId": {
      "type": "string"
    },
    "createdAt": {
      "type": "string",
      "format": "date-time"
    },
    "updatedAt": {
      "type": "string",
      "format": "date-time"
    },
    "rowVersion": {
      "type": [
        "string",
        "integer"
      ],
      "pattern": "^-?(?:0|[1-9]\\d*)$"
    },
    "deletedAt": {
      "type": [
        "string",
        "null"
      ],
      "format": "date-time"
    },
    "isDeleted": {
      "type": "boolean"
    },
    "domainEvents": {
      "type": [
        "array",
        "null"
      ],
      "items": {
        "type": "object",
        "properties": {
          "eventId": {
            "type": [
              "string",
              "null"
            ]
          },
          "occurredAt": {
            "type": "string",
            "format": "date-time"
          },
          "version": {
            "type": [
              "string",
              "integer"
            ],
            "pattern": "^-?(?:0|[1-9]\\d*)$"
          }
        },
        "required": [
          "eventId",
          "occurredAt",
          "version"
        ]
      }
    }
  },
  "required": [
    "saleId",
    "vatRateId",
    "percentage",
    "code",
    "net",
    "vat",
    "gross",
    "id",
    "companyId",
    "createdAt",
    "updatedAt",
    "rowVersion",
    "deletedAt",
    "isDeleted",
    "domainEvents"
  ]
}
