{
  "saleId": "01K5VB000000000SR001000482",
  "vatRateId": "01K5T0Q8C4000000000000V002",
  "percentage": 0,
  "code": "Z",
  "net": 1.45,
  "vat": 0.00,
  "gross": 1.45,
  "id": "01K5VB0000000SVZR001000482",
  "companyId": "01K5T0Q8C4000000000000C001",
  "createdAt": "2026-09-23T09:41:12Z",
  "updatedAt": "2026-09-23T09:41:12Z",
  "rowVersion": 1,
  "deletedAt": null,
  "isDeleted": false,
  "domainEvents": []
}
